{
  "study_version": "0019-source-yield-v1",
  "generated_at": "2026-08-23T01:20:00Z",
  "scope_note": "Deliberately varied 20-entity source-yield sample. This is a source-strategy measurement, not population-statistical inference and not authorization for bulk ingestion. Approximate model counts describe discoverable production-sailboat identities on the cited source surfaces, not canonical HullQ admissions.",
  "sample_count": 20,
  "method": {
    "selection": "Verified manufacturer/yard records chosen to span active and historical entities, high-volume and specialist builders, monohulls and multihulls, multiple macro-regions, strong official archives, contract-yard cases, and difficult archival-only cases.",
    "field_scale": ["strong", "partial", "weak", "unknown"],
    "field_scale_note": "core_dimensions_availability and critical_technical_fields_availability are free-text measurements anchored on these reference tokens (they may qualify or combine them, e.g. 'strong current; partial historical') rather than a single strict enum, because the qualifying context is itself part of the measurement.",
    "automation_scale": ["low", "low-medium", "medium", "medium-high", "high"],
    "review_burden_scale": ["low", "low-medium", "medium", "medium-high", "high"],
    "rights_rule": "Public readability is discovery evidence only. Unless a separate licence or terms review clears systematic reuse, later systematic use remains REQUIRES_REVIEW.",
    "overlap_probe": "probe_model_names are compared later only by exact preferred-label equality against AUTO_ADMIT candidates in the accepted SLICE-0017 and SLICE-0018 manifests. Alias/case-only signals are reported as unresolved possible overlap, never forced matches."
  },
  "entities": [
    {
      "preferred_display_name": "Catalina Yachts",
      "region": "North America",
      "activity_class": "active",
      "production_scale": "high-volume",
      "hull_form": "monohull",
      "sample_reason": "Large active builder with a strong official history plus a broad manufacturer-hosted brochure archive.",
      "discoverable_model_identity_estimate": "40+",
      "model_list_mode": "explicit archive index plus current-range pages",
      "production_year_evidence": "strong",
      "core_dimensions_availability": "strong",
      "critical_technical_fields_availability": "partial",
      "expansion_pattern": "index plus linked model brochures/pages",
      "source_volatility": "low-medium",
      "automation_suitability": "high",
      "systematic_use_status": "REQUIRES_REVIEW",
      "human_review_burden": "low-medium",
      "measurement_note": "Official brochure archive exposes dozens of historical models; current model pages and brochures usually provide LOA/LWL/beam/draft/displacement. Keel, rig, material and variant detail generally requires following the model-specific page or brochure.",
      "probe_model_names": ["Catalina 22", "Catalina 30", "Catalina 42"],
      "evidence_urls": [
        "https://www.catalinayachts.com/history/",
        "https://www.catalinayachts.com/brochure-archives/",
        "https://www.catalinayachts.com/ocean-series/",
        "https://www.catalinayachts.com/sport-series/"
      ]
    },
    {
      "preferred_display_name": "Pearson Yachts",
      "region": "North America",
      "activity_class": "historical",
      "production_scale": "high-volume historical",
      "hull_form": "monohull",
      "sample_reason": "Historical builder whose surviving owner archive preserves a near-model-index and original factory documentation.",
      "discoverable_model_identity_estimate": "30+",
      "model_list_mode": "explicit owner-archive model table",
      "production_year_evidence": "strong",
      "core_dimensions_availability": "strong",
      "critical_technical_fields_availability": "partial-strong",
      "expansion_pattern": "model index plus linked original brochures and model pages",
      "source_volatility": "medium",
      "automation_suitability": "medium-high",
      "systematic_use_status": "REQUIRES_REVIEW",
      "human_review_burden": "low-medium",
      "measurement_note": "The owners' archive exposes dedicated pages and original brochures for many models. Basic dimensions, displacement, ballast and rig data are commonly available; variants and some appendage details still require per-model review.",
      "probe_model_names": ["Pearson 26", "Pearson 30", "Pearson 36"],
      "evidence_urls": [
        "https://pearsonyachts.org/",
        "https://www.pearsonyachts.org/pearson-archives.html",
        "https://www.pearsonyachts.org/models/pearson-26.html"
      ]
    },
    {
      "preferred_display_name": "Tillotson-Pearson (TPI)",
      "region": "North America",
      "activity_class": "historical",
      "production_scale": "large contract yard",
      "hull_form": "mixed monohull/multihull",
      "sample_reason": "Contract-manufacturing yard that built for multiple brands; deliberately tests yard-to-brand reconstruction rather than a clean consumer-brand archive.",
      "discoverable_model_identity_estimate": "20+ reconstructable across brand histories; no safe single-yard total",
      "model_list_mode": "reconstructed across J/Boats, Freedom, Alerion and other brand histories",
      "production_year_evidence": "partial-strong",
      "core_dimensions_availability": "partial",
      "critical_technical_fields_availability": "partial",
      "expansion_pattern": "multi-source relationship expansion",
      "source_volatility": "medium-high",
      "automation_suitability": "low-medium",
      "systematic_use_status": "REQUIRES_REVIEW",
      "human_review_burden": "high",
      "measurement_note": "TPI is valuable as a physical-builder identity but poor as a single model-discovery endpoint. Brand histories clearly establish J/Boats, Freedom and Alerion production relationships; model-level technical facts should be sourced from the corresponding brand/model archives, not inferred from TPI alone.",
      "probe_model_names": ["J/24", "Freedom 40", "Alerion Express 28"],
      "evidence_urls": [
        "https://goodoldboat.com/across-the-bar-everett-pearson/",
        "https://goodoldboat.com/freedom-38/",
        "https://www.windcheckmagazine.com/article/alerion-past-present-and-future-perfect-part-ii-the-big-bird-rises-alerion-iii-reborn-in-new-england-1977-to-present/"
      ]
    },
    {
      "preferred_display_name": "Oyster Yachts",
      "region": "UK & Ireland",
      "activity_class": "active",
      "production_scale": "specialist/semi-custom series",
      "hull_form": "monohull",
      "sample_reason": "Exceptionally strong official heritage model index with detailed model pages.",
      "discoverable_model_identity_estimate": "46 heritage models plus current range",
      "model_list_mode": "explicit official heritage index",
      "production_year_evidence": "strong",
      "core_dimensions_availability": "strong",
      "critical_technical_fields_availability": "partial-strong",
      "expansion_pattern": "one index plus linked model pages",
      "source_volatility": "low",
      "automation_suitability": "high",
      "systematic_use_status": "REQUIRES_REVIEW",
      "human_review_burden": "low",
      "measurement_note": "Official heritage pages commonly retain years built, hull counts and LOA/LWL/beam/draft/displacement. The archive is one of the cleanest observed manufacturer surfaces for identity expansion and later technical enrichment.",
      "probe_model_names": ["Oyster 26", "Oyster 53", "Oyster 56"],
      "evidence_urls": [
        "https://oysteryachts.com/heritage-yachts/",
        "https://oysteryachts.com/heritage-yachts/oyster-26/",
        "https://oysteryachts.com/heritage-yachts/oyster-53/"
      ]
    },
    {
      "preferred_display_name": "Westerly Marine",
      "region": "UK & Ireland",
      "activity_class": "historical",
      "production_scale": "high-volume historical",
      "hull_form": "monohull",
      "sample_reason": "Defunct high-volume builder with an unusually rich owners-association wiki and brochure archive.",
      "discoverable_model_identity_estimate": "30+",
      "model_list_mode": "explicit owner-wiki lists and brochure index",
      "production_year_evidence": "strong",
      "core_dimensions_availability": "strong",
      "critical_technical_fields_availability": "strong on many brochure/model pages",
      "expansion_pattern": "archive index plus linked brochures/specifications",
      "source_volatility": "medium",
      "automation_suitability": "medium-high",
      "systematic_use_status": "REQUIRES_REVIEW",
      "human_review_burden": "medium",
      "measurement_note": "The archive exposes many model brochures, specifications and keel/rig variants. Variant naming and corporate-era changes require review even though raw source depth is high.",
      "probe_model_names": ["Westerly Centaur", "Westerly Fulmar", "Westerly Oceanlord"],
      "evidence_urls": [
        "https://westerly-owners.co.uk/a-brief-history/",
        "https://wiki.westerly-owners.co.uk/index.php?title=Westerly_Brochures"
      ]
    },
    {
      "preferred_display_name": "Northshore Yachts",
      "region": "UK & Ireland",
      "activity_class": "historical",
      "production_scale": "multi-brand production yard",
      "hull_form": "monohull",
      "sample_reason": "Tests production-yard discovery where useful model identities live under Southerly and Vancouver rather than the yard name.",
      "discoverable_model_identity_estimate": "20+ reconstructed across Southerly and Vancouver",
      "model_list_mode": "reconstructed across brand histories",
      "production_year_evidence": "strong for major ranges",
      "core_dimensions_availability": "partial",
      "critical_technical_fields_availability": "strong for variable-draft/keel concepts; mixed otherwise",
      "expansion_pattern": "multi-source brand/yard expansion",